{
  "schema_version": "1.0",
  "metadata": {
    "base_model": "meta-llama/Llama-3.2-1B-Instruct",
    "seeds": {
      "data": 6604,
      "train": 6604,
      "eval": 6604
    },
    "judge": {
      "backend": "local_hf",
      "model": "meta-llama/Llama-3.1-8B-Instruct",
      "rubric_version": "1.0"
    },
    "betas": [
      0.3,
      0.5,
      0.7
    ]
  },
  "eval_sets": {
    "ambiguous": {
      "path": "eval/held_out_ambiguous.jsonl",
      "n": 10
    },
    "clear": {
      "path": "eval/held_out_clear.jsonl",
      "n": 10
    },
    "mmlu": {
      "path": "eval/mmlu_slice.jsonl",
      "n": 5
    }
  },
  "runs": {
    "base": {
      "ask_rate": 0.9,
      "answer_rate": 0.6,
      "mmlu_acc": 0.2,
      "label_counts": {
        "ambiguous": {
          "ask": 9,
          "answer": 1,
          "other": 0
        },
        "clear": {
          "ask": 0,
          "answer": 6,
          "other": 4
        }
      }
    },
    "sft": {
      "ask_rate": 1.0,
      "answer_rate": 0.5,
      "mmlu_acc": 0.2,
      "label_counts": {
        "ambiguous": {
          "ask": 10,
          "answer": 0,
          "other": 0
        },
        "clear": {
          "ask": 0,
          "answer": 5,
          "other": 5
        }
      }
    },
    "dpo": [
      {
        "ask_rate": 1.0,
        "answer_rate": 0.5,
        "mmlu_acc": 0.2,
        "label_counts": {
          "ambiguous": {
            "ask": 10,
            "answer": 0,
            "other": 0
          },
          "clear": {
            "ask": 0,
            "answer": 5,
            "other": 5
          }
        },
        "beta": 0.3
      },
      {
        "ask_rate": 1.0,
        "answer_rate": 0.5,
        "mmlu_acc": 0.2,
        "label_counts": {
          "ambiguous": {
            "ask": 10,
            "answer": 0,
            "other": 0
          },
          "clear": {
            "ask": 0,
            "answer": 5,
            "other": 5
          }
        },
        "beta": 0.5
      },
      {
        "ask_rate": 1.0,
        "answer_rate": 0.5,
        "mmlu_acc": 0.2,
        "label_counts": {
          "ambiguous": {
            "ask": 10,
            "answer": 0,
            "other": 0
          },
          "clear": {
            "ask": 0,
            "answer": 5,
            "other": 5
          }
        },
        "beta": 0.7
      }
    ]
  }
}